{
  "id": "exec-test-001",
  "recommendation_id": "rec-test-001",
  "approval_id": "appr-test-001",
  "operation": "OPERATION_TYPE_RECOMMEND",
  "target": "asset-test-web-01",
  "started_at": "2026-09-12T09:10:00Z",
  "finished_at": "2026-09-12T09:10:01Z",
  "success": true,
  "detail": "synthetic contract test data — simulated executor did what was asked; not proof of security"
}
